Sandpiper Hotel,Reviewed: 11 June 2018,Australia,3.3,2,“Infuriating waste of my money”,"['• Leisure trip', '• Family with young children', '• Superior Double or Twin Room (No Window)', '• Stayed 2 nights', '• Submitted via mobile']",Everything,"This is a terrible hotel, no hotwater!! At all pathetic theres not excuse for it.
Staff were unfrienly and unhelpful on check in as something went wrong with the booking they charged me twice taking money out of my account twice with out my promission when it said i would pay at the property. Terrible.",Stayed in June 2018,6.1,6.2,5.7,7.3,5.7,6.1,5.7,6.5
Sandpiper Hotel,Reviewed: 4 June 2018,USA,8.3,6,“Just nice to go with.”,"['• Solo traveller', '• Superior Double or Twin Room (No Window)', '• Stayed 6 nights', '• Submitted via mobile']",Repeated request was made every time for small issues. Then only the matter was taken into consideration.,Just comfortable and convenience friendly to commute to other places.,Stayed in June 2018,6.1,6.2,5.7,7.3,5.7,6.1,5.7,6.5
Sandpiper Hotel,Reviewed: 24 May 2018,Philippines,7.1,2,“It was near the mrt station and accessible to foodS ...”,"['• Leisure trip', '• People with friends', '• Superior Double or Twin Room (No Window)', '• Stayed 3 nights', '• Submitted via mobile']",Room was small compare to the picture. A little bit pricey. It’s not what we expected,"It was near the mrt station and accessible to foodS ,Souvenir shops and  the other staff are nice exept for the one tall indian girl who answer my call in the information. She was rude",Stayed in May 2018,6.1,6.2,5.7,7.3,5.7,6.1,5.7,6.5
Sandpiper Hotel,Reviewed: 7 May 2018,South Africa,3.3,10,“This is a backpackers place that doesn't deserve the 3 stars”,"['• Leisure trip', '• Group', '• Superior Double or Twin Room (No Window)', '• Stayed 3 nights', '• Submitted via mobile']","The old guy at reception showed very little respect for us Africans. He gave us the worst of all rooms in the property. Not the room we initially booked. His attitude seemed to change when he realized we took offense at some of his comments. The rooms aren't clean to standard, the mattress are old, the rooms are tiny no space to move around worse with no window",The lady receptionist was nice and friendly,Stayed in May 2018,6.1,6.2,5.7,7.3,5.7,6.1,5.7,6.5
Sandpiper Hotel,Reviewed: 3 May 2018,Vietnam,3.3,8,"“There was fun trip, except the hotel experience.”","['• Leisure trip', '• Group', '• Family Nest - No Window', '• Stayed 3 nights']","We stay in 3 nights. Beds are not comfortable at all. Our room has 3 single beds and the foot of one bed has been broken. I told to the male receptionist but they just put a cup under the bed and it wasn't solve anything. At the night, it's hard to be sleep cause of sounds of the water flows in the pipes. The male receptionist is unfriendly, he always try to mess up with us when we are talking with him. On the last night, we couldn't open our room by key card cause he locked the system so we had to wait him for a long time to open the door. It is ridiculous and unacceptable!",The location is near MRT,Stayed in May 2018,6.1,6.2,5.7,7.3,5.7,6.1,5.7,6.5
Sandpiper Hotel,Reviewed: 1 May 2018,Malaysia,10,2,“Its was nice”,"['• Leisure trip', '• Group', '• Superior Double or Twin Room (No Window)', '• Stayed 1 night', '• Submitted via mobile']",Barely nothing to say much haha,Hotel is very comfortable and cozy for a reasonable price.And nearby has many shops and restaurants as well some iconic landmarks.,Stayed in April 2018,6.1,6.2,5.7,7.3,5.7,6.1,5.7,6.5
Sandpiper Hotel,Reviewed: 25 April 2018,Malaysia,7.9,1,“The communication with staff was good.”,"['• Leisure trip', '• Group', '• Superior Double or Twin Room (No Window)', '• Stayed 2 nights']",We asked for single bed ended up getting queen bed. And room was a bit smaller,The communication with staff was good. They were very helpful and welcoming,Stayed in April 2018,6.1,6.2,5.7,7.3,5.7,6.1,5.7,6.5
Sandpiper Hotel,Reviewed: 12 April 2018,Indonesia,7.1,2,“Never though that the room was so small”,"['• Couple', '• Superior Double or Twin Room (No Window)', '• Stayed 1 night']","The room and the bathroom were really small. You can't even walk on the room.
No fridge and no matt for the bathroom. It's really different then what it's look like on the picture","Well, I love the Aircon definitely, also the hotel have lift. The location is really good. The staffs are quite nice.",Stayed in April 2018,6.1,6.2,5.7,7.3,5.7,6.1,5.7,6.5
Sandpiper Hotel,Reviewed: 8 April 2018,India,5.0,5,"“Would not recommend, if you go for this property check room vth window, stay away from tht lady”","['• Leisure trip', '• Couple', '• Superior Double or Twin Room (No Window)', '• Stayed 4 nights', '• Submitted via mobile']","The room didn't have a window, would not recommend anyone, as this was not told while booking. Staff one lady very rude, wanted to leave the hotel day one we checked in. But the only staff Mr. Gill was kind and such a nice person made me stay back. The lady has a dark complection, has no sense  how treat a customer.  Wouldn't recommend this place just because of this lady.","The property is located in a nice locality, easy access to MRT",Stayed in March 2018,6.1,6.2,5.7,7.3,5.7,6.1,5.7,6.5
Sandpiper Hotel,Reviewed: 2 April 2018,India,3.8,3,"“Find better option in same price. Check for dimensions  of room, bed first  before booking”","['• Leisure trip', '• Group', '• Superior Double or Twin Room (No Window)', '• Stayed 4 nights']","Room is very small and makes a lot of congestion.  Once a guest keeps 2 bags to 3 bags, no space to walk is left behind. Hand shower was  leaking. Bed  sheet not replaced,bed rolls not reshuffled","Location, Next to ROCHOR MRT station.  Bed and Mattress are OK.",Stayed in March 2018,6.1,6.2,5.7,7.3,5.7,6.1,5.7,6.5
Sandpiper Hotel,Reviewed: 13 March 2018,Indonesia,7.5,2,"“Will definitely come back again. Keep your performance, Sandpiper”","['• Leisure trip', '• Family with young children', '• Superior Double or Twin Room (No Window)', '• Stayed 1 night', '• Submitted via mobile']",Nothing but the room is quite small but still comfort thou.,"The location is very accessible - near Rochor MRT station, Muslim food Resto 24 hours open, Mustafa Center, the staff is very polite - communicative. And the owner is also warm and make conversation with guests.",Stayed in March 2018,6.1,6.2,5.7,7.3,5.7,6.1,5.7,6.5
Sandpiper Hotel,Reviewed: 25 February 2018,Singapore,4.2,4,“Uncomfortable”,"['• Leisure trip', '• Couple', '• Superior Double or Twin Room (No Window)', '• Stayed 3 nights', '• Submitted via mobile']","Rooms are very small. Beds are small in length, only 4 to 5 feet people can sleep. No place for keeping luggage. Stayed just like a packed package.",Location,Stayed in February 2018,6.1,6.2,5.7,7.3,5.7,6.1,5.7,6.5
Sandpiper Hotel,Reviewed: 19 February 2018,Singapore,5.0,49,“Upset staycation”,"['• Leisure trip', '• Group', '• Superior Double or Twin Room (No Window)', '• Stayed 1 night', '• Submitted via mobile']","It time to check and do room maintenance especially toilet bowl cover loosen, closet for hanging shirt too small. Kettle not working well. No mineral water even though you booking for 2 pax. Wall socket plug not working properly.","Outview of the hotel is so nice,nearby all food area and area is very silent during night. Definitely you will have good rest.",Stayed in February 2018,6.1,6.2,5.7,7.3,5.7,6.1,5.7,6.5
Sandpiper Hotel,Reviewed: 18 February 2018,Philippines,6.7,2,“Friendly staff.”,"['• Leisure trip', '• People with friends', '• Superior Double or Twin Room (No Window)', '• Stayed 2 nights', '• Submitted via mobile']","Can hear noises from the hallway. Room cleaning service not that good, did not change towels and give water on the second day.",Friendly staff. Near rochor mrt,Stayed in February 2018,6.1,6.2,5.7,7.3,5.7,6.1,5.7,6.5
Sandpiper Hotel,Reviewed: 11 February 2018,United Kingdom,5.0,13,"“It was terrible, no sleep, no staff to complain to on the front desk. Not good even for a dog!”","['• Leisure trip', '• Solo traveller', '• Superior Double or Twin Room (No Window)', '• Stayed 3 nights']","The noise was unbelievable, I could not sleep, slamming doors all night adjacent to the room, store cupboards next to my room contributing to the overall noise.",,Stayed in February 2018,6.1,6.2,5.7,7.3,5.7,6.1,5.7,6.5
Sandpiper Hotel,Reviewed: 8 February 2018,United Kingdom,3.3,3,“Nothing at all”,"['• Leisure trip', '• Family with young children', '• Family Nest - No Window', '• Stayed 4 nights', '• Submitted via mobile']","Provided a basement family room with no windows, Stayed for 4 nights - bed linens  never changed. Staff are at times very rude. Recommend to avoid this hotel at all cost.",Nothing at all,Stayed in February 2018,6.1,6.2,5.7,7.3,5.7,6.1,5.7,6.5
Sandpiper Hotel,Reviewed: 7 February 2018,Sri Lanka,8.8,1,“It was a great experience”,"['• Leisure trip', '• Couple', '• Superior Double or Twin Room (No Window)', '• Stayed 3 nights', '• Submitted via mobile']","Should serve meals which would be perfect and certain rooms should
Be slightly bigger",The location was very good. Gill is an amazing member of staff and is an asset to the place!,Stayed in February 2018,6.1,6.2,5.7,7.3,5.7,6.1,5.7,6.5
Sandpiper Hotel,Reviewed: 4 February 2018,USA,2.5,3,“This is the worst hotel I've ever stayed in.”,"['• Leisure trip', '• Group', '• Superior Double or Twin Room (No Window)', '• Stayed 2 nights']","This hotel does not even qualify as a two star. Poor neighborhood, poor service and maintenance, and not worth for the rate they charge. I'll not recommend Sandpiper to anyone. It's much better to spend little bit more money to stay in a other hotels nearby.",Nothing to like about this hotel.,Stayed in January 2018,6.1,6.2,5.7,7.3,5.7,6.1,5.7,6.5
Sandpiper Hotel,Reviewed: 4 February 2018,Fiji,2.5,3,“Nightmare at Sandpiper Hotel!!!”,"['• Leisure trip', '• Couple', '• Superior Double or Twin Room (No Window)', '• Stayed 5 nights']",We didn't like anything about Sandpiper Hotel..from the management to staff. Facilities are very poor and unhygienic.,We didn't like a single thing about Sandpiper Hotel..except A kind hearted human named Mr.Gill.,Stayed in January 2018,6.1,6.2,5.7,7.3,5.7,6.1,5.7,6.5
Sandpiper Hotel,Reviewed: 4 February 2018,Fiji,2.9,3,“Nightmare at Sandpiper Hotel!!!”,"['• Leisure trip', '• Couple', '• Superior Double or Twin Room (No Window)', '• Stayed 2 nights']","Everything, room uncleaned, dirty linen and towel, noisy, A/C not working properly. leaking kettle, dirty doormat, no space for luggage, the entire floor of the hotel has never been vacuumed, very rude Indian staffs..Management itself is two faced.",We only liked a Staff named Mr Gill !!!,Stayed in January 2018,6.1,6.2,5.7,7.3,5.7,6.1,5.7,6.5
Sandpiper Hotel,Reviewed: 24 January 2018,India,2.5,2,“not good .”,"['• Leisure trip', '• Couple', '• Superior Double or Twin Room (No Window)', '• Stayed 3 nights']","the rooms are very small u cant even imagine . even ur house kitchen will be bigger than this hotel room . its like u staying in a match box . worst experience of my life . but we already paid the amount , the reception guy didnt allow us to view the room and we had to make the payment . after we made the payment realised it was mistake . huge mistake . apart from location there is nothing good about it . room are very very small guys . dnt pay before have a look of a room .",only the location,Stayed in January 2018,6.1,6.2,5.7,7.3,5.7,6.1,5.7,6.5
Sandpiper Hotel,Reviewed: 4 January 2018,Malaysia,5.4,37,“Great for a one night stay to rejuvenate.”,"['• Couple', '• Superior Double or Twin Room (No Window)', '• Stayed 1 night', '• Submitted via mobile']","Not recommend for more than a day's stay. The bedding is uncomfortable, the shower heater is not working properly and the room is very small for minimum movements only.",It's right across Sim Lim Square. Lot's of public transport choices. Great for a 1 night stay to recharge your body.,Stayed in January 2018,6.1,6.2,5.7,7.3,5.7,6.1,5.7,6.5
Sandpiper Hotel,Reviewed: 3 January 2018,Vietnam,5.0,1,“Would be much better if we could have booked a better room with window(s).”,"['• Leisure trip', '• Family with young children', '• Superior Double or Twin Room (No Window)', '• Stayed 2 nights']","The room has no window at all (though when booking the room and reviewing information on Booking.com, we could not recognise this deficiency). The hotel room lacks of certain basic items (e.g., tissues, paper slippers, etc).",the location (little india) is unique and worth trying.,Stayed in January 2018,6.1,6.2,5.7,7.3,5.7,6.1,5.7,6.5
Sandpiper Hotel,Reviewed: 3 January 2018,Indonesia,2.5,1,“Reception staff was awful.”,"['• Leisure trip', '• Family with young children', '• Superior Double or Twin Room (No Window)', '• Stayed 1 night', '• Submitted via mobile']","Reception staff was awful. I felt being offended commutating with him. He asked me to check out on 8:45am before manager come to hotel.
I was charged 50$ when checking in for bringing my children staying with me. And saying there will be additional charge if the manager knowing I brought 2 children, meaning 50$/child. On the hotel official website, it is stated that there will be additional 30$per child per night (>3yrs). 
The room was very small and not clean though. There was a used towels on the floor in the bathroom.
I met the manager in the morning before I checked out and she was a customer service oriented person actually. She needs to discipline her staffs. 
Totally no a pleasant stay at all for me and my family.",,Stayed in December 2017,6.1,6.2,5.7,7.3,5.7,6.1,5.7,6.5
Sandpiper Hotel,Reviewed: 1 January 2018,Bulgaria,10,2,"“I had a nice and pleasant stay, great value for money.”","['• Leisure trip', '• Family with young children', '• Superior Double or Twin Room (No Window)', '• Stayed 3 nights']",,"Helpful stuff and perfect location. I had a room with a window but there was no mosquito net on it, so I could not open it. However, that is normal for Asia.",Stayed in December 2017,6.1,6.2,5.7,7.3,5.7,6.1,5.7,6.5
Sandpiper Hotel,Reviewed: 31 December 2017,Singapore,3.8,1,"“Unhygenic place, not worth the $ (mind you it was over 100 per night)”","['• Leisure trip', '• Couple', '• Superior Double or Twin Room (No Window)', '• Stayed 1 night']","Dirty rooms, aircon was working but it had an open filter with dust collecting all over it. Bedsheets were clean but bed frames were dirty with a stale smell. Didn't stay the full night and left.",Nil,Stayed in December 2017,6.1,6.2,5.7,7.3,5.7,6.1,5.7,6.5
Sandpiper Hotel,Reviewed: 25 December 2017,Singapore,4.6,5,“Just nice”,"['• Leisure trip', '• Solo traveller', '• Superior Double or Twin Room (No Window)', '• Stayed 1 night', '• Submitted via mobile']",I had to pay again despite it was charged my debit card online. The reception guy didn't help much to check on this. Hope I will get refund soon. Why need to pay twice I wonder?,The location,Stayed in December 2017,6.1,6.2,5.7,7.3,5.7,6.1,5.7,6.5
Sandpiper Hotel,Reviewed: 12 December 2017,Singapore,6.7,13,“Spoilt my date”,"['• Couple', '• Superior Double or Twin Room (No Window)', '• Stayed 1 night', '• Submitted via mobile']","Just 5 minutes after i put my bread on the coffee counter, i saw a lot of small ants, room was too small, kettle was smelly and rusty inside..","Beautiful lobby and corridor, friendly reception.",Stayed in December 2017,6.1,6.2,5.7,7.3,5.7,6.1,5.7,6.5
Sandpiper Hotel,Reviewed: 2 December 2017,United Kingdom,4.2,1,“Wouldn't stay again. Cheaper and better hotels in Singapore.”,"['• Leisure trip', '• Solo traveller', '• Superior Double or Twin Room (No Window)', '• Stayed 1 night', '• Submitted via mobile']","They made me change rooms on the second day of my stay. However the room wasn't ready for me so I had to leave all my belongings in the hallway. The cleaners wouldn't allow me into the room & I couldn't get the key to my old room so was basically kicked out?  In the afternoon I went back and an alarm was going off which they couldn't turn off. I asked for another room but they said I would have to wait until later. When I came back later that night the alarm was still going and then the couple next door had a shouting match. I had to demand another room which I got. In the morning I complained about these issues and was told the management weren't available to talk to & I would have to wait 14 days before I would get a decision on wether or not I would receive any compensation? Overall the rooms are very small for the price. Most without windows, Showers all needed repair or maintenance work doing & the  kettle in one of the rooms didn't work. Staff polite but pushy and slow to take action.",,Stayed in November 2017,6.1,6.2,5.7,7.3,5.7,6.1,5.7,6.5
Sandpiper Hotel,Reviewed: 28 November 2017,Brunei Darussalam,4.2,1,“Bad service from one particular receptionist”,"['• Family with young children', '• Superior Double or Twin Room (No Window)', '• Stayed 5 nights', '• Submitted via mobile']","The reception is so rude to my 15 year old son who is staying there with his cousin. Bad experience for him. They got a room at the basement on 1st night with double bed. Early request and it was confirmed to be 2 single beds. The receptionist also called me many times in Brunei over his blank mind over my son’s luggages he left with him and scared my son that he will charge that calls he made many times. Even rude over the phone with me, i mean he was really really rude raising his voice to me. He shouldn’t work in hotel industry. Also the hotel is inefficient over sorting out our bookings. One, the reception couldn’t find my name or my son’s name. Secondly, there were double bookings despite confirmation from booking.com that it was just changed in name. Thirdly, the booking was stated as confirmed but they did not manage to secure the booking and end up staying at the basement in a small room with nothing works even the water heater. Forthly, they insisted to give double bed, and said our booking was for double bed, and gave room with 2 single beds when my 15 yr old son pointed on his form that it was for 2 single beds. This is the worst treatment ever. Please look into this and I hope booking.com take this as serious matter. At least an apology from the GM of the hotel. Thank you.",Hotel near MRT,Stayed in November 2017,6.1,6.2,5.7,7.3,5.7,6.1,5.7,6.5
Sandpiper Hotel,Reviewed: 21 November 2017,Singapore,7.1,12,“Cheap hotel that doesn't scream cheap”,"['• Business trip', '• Couple', '• Superior Double or Twin Room (No Window)', '• Stayed 1 night', '• Submitted via mobile']","Man who served as at check in could have been pleasant. No smile, no real welcome, even forgot to give us the WiFi information. When we came back to the front desk to ask for it, he said he had already given us the info in a gruff manner. He did eventually give us the details though. But some customer service training would help this place go a long way.",It was a cheap option that didn't scream cheap in a very central part of Singapore.,Stayed in October 2017,6.1,6.2,5.7,7.3,5.7,6.1,5.7,6.5
Sandpiper Hotel,Reviewed: 19 November 2017,Malaysia,4.2,1,“My advice Please Look For Another Hotel.”,"['• Leisure trip', '• Family with young children', '• 2 rooms', '• Stayed 2 nights', '• Submitted via mobile']",Not clean especially airocond full of dust.They didnt fullfill my requirement that i stated before i book.The receptionist should aware what are the guest requirement because we didnt stay for free.in my case i even call a day before to make sure all go well.but the receptionist like shock when we are 5 people.my mother room under basement can heard noise like bubling water on her seiling all day.i really dont know what is actually going on.and i thought they money will be deducted online since i already gave my detail but they ask me to swipe the card there.Receptionist should be more friendly and smiley.Dont show ur stif face to us.We are not that annoying guest.even we leave the room clean as it was.,Locatian was great.Easy access to city and airport.,Stayed in November 2017,6.1,6.2,5.7,7.3,5.7,6.1,5.7,6.5
Sandpiper Hotel,Reviewed: 18 November 2017,Singapore,8.8,3,“The staff that attended me during my check out is very...”,"['• Leisure trip', '• Solo traveller', '• Superior Double or Twin Room (No Window)', '• Stayed 1 night']","The staff that attended me during my check out is very impolite and she speak in a very inappropriate manner. Accusing the customer for smoking just because i threw a cigarette bud in a bin doesn't mean i smoke in the room. With her own miscommunication mistake and not accepting customer's explanation is unacceptable. I hope the higher management would do something about it like, teach them a basic ethic of being in a customer service line would need a basic respect. How you speak is how you portray yourself. But thanks to the nice and friendly man who attended during our check-in, he's a good role model for her to look up on.",,Stayed in November 2017,6.1,6.2,5.7,7.3,5.7,6.1,5.7,6.5
Sandpiper Hotel,Reviewed: 25 October 2017,France,8.8,1,"“A clean, calm, nice and correct place to stay near Bugis and Little India.”","['• Solo traveller', '• Deluxe Double or Twin Room', '• Stayed 2 nights']","Not a special critic to the hotel but to the current hotel system in Singapore; a room should not be considered as ""deluxe"" just because having a window. Access to natural light is a right for all living beings,not a luxury!","Friendly staff, clean and silent hotel in spite of its location (the neighborhood is rather loud but the hotel is well isolated). Excellent WiFi connectivity and close to the main points of Bugis and Little India.",Stayed in September 2017,6.1,6.2,5.7,7.3,5.7,6.1,5.7,6.5
Sandpiper Hotel,Reviewed: 22 October 2017,Romania,5.8,1,“We stayed 2 nights at this hotel because it was the cheapest option from that area.”,"['• Leisure trip', '• Couple', '• Superior Double or Twin Room (No Window)', '• Stayed 2 nights', '• Submitted via mobile']","The room was very small and the air con was just above the bed. We were not able to sleep wit the air con turned on, but we were not able to sleep with it turned off either - so we eventually moved the bed a little bit.",Good location. Cheap for Singapore prices.,Stayed in October 2017,6.1,6.2,5.7,7.3,5.7,6.1,5.7,6.5
Sandpiper Hotel,Reviewed: 9 October 2019,Pakistan,5.4,1,“Just a location at corner.”,"['• Leisure trip', '• Family with young children', '• Superior Twin Nest - No Window', '• Stayed 3 nights', '• Submitted via mobile']",The staff was rude,Just a location at corner.,Stayed in October 2019,6.1,6.2,5.7,7.3,5.7,6.1,5.7,6.5
Sandpiper Hotel,Reviewed: 8 October 2019,Sri Lanka,7.9,1,“The Manager was very friendly”,"['• Leisure trip', '• Couple', '• Superior Queen Nest - No Window', '• Stayed 4 nights', '• Submitted via mobile']",,The Manager was very friendly,Stayed in October 2019,6.1,6.2,5.7,7.3,5.7,6.1,5.7,6.5
Sandpiper Hotel,Reviewed: 7 October 2019,Singapore,5.4,12,“Why need to collect money for smoking”,"['• Leisure trip', '• Family with young children', '• Superior Queen Nest - No Window', '• Stayed 2 nights', '• Submitted via mobile']",Nothing,The staff was so bad,Stayed in September 2019,6.1,6.2,5.7,7.3,5.7,6.1,5.7,6.5
Sandpiper Hotel,Reviewed: 26 September 2019,Malaysia,2.9,3,“Nothing ”,"['• Business trip', '• Solo traveller', '• Deluxe Queen Nest - With Window', '• Stayed 1 night', '• Submitted via mobile']",The facility is not suitable for hospitality industry,Nothing,Stayed in September 2019,6.1,6.2,5.7,7.3,5.7,6.1,5.7,6.5
Sandpiper Hotel,Reviewed: 20 September 2019,Singapore,10,6,“Nice food nearby”,"['• Leisure trip', '• Solo traveller', '• Superior Queen Nest - No Window', '• Stayed 1 night', '• Submitted via mobile']",Room was a bit small,Nice food nearby,Stayed in September 2019,6.1,6.2,5.7,7.3,5.7,6.1,5.7,6.5
Sandpiper Hotel,Reviewed: 18 September 2019,Qatar,7.5,1,“Old guy at reception ”,"['• Leisure trip', '• Family with young children', '• Deluxe Twin Nest - With Window', '• Stayed 3 nights', '• Submitted via mobile']",Old guy at reception,,Stayed in September 2019,6.1,6.2,5.7,7.3,5.7,6.1,5.7,6.5
Sandpiper Hotel,Reviewed: 13 September 2019,Singapore,7.5,8,"“The wifi is very poor,they should put a password for that...”","['• Couple', '• Superior Queen Nest - No Window', '• Stayed 1 night', '• Submitted via mobile']","The wifi is very poor,they should put a password for that wifi..",,Stayed in September 2019,6.1,6.2,5.7,7.3,5.7,6.1,5.7,6.5
Sandpiper Hotel,Reviewed: 13 September 2019,,4.6,6,“location is ok.”,"['• Business trip', '• Solo traveller', '• Superior Queen Nest - No Window', '• Stayed 3 nights']",not to say any good things in this hotel,location is ok. room is not comfortable.,Stayed in September 2019,6.1,6.2,5.7,7.3,5.7,6.1,5.7,6.5
Sandpiper Hotel,Reviewed: 9 September 2019,Singapore,7.9,1,“No window”,"['• Leisure trip', '• Couple', '• Superior Twin Nest - No Window', '• Stayed 1 night', '• Submitted via mobile']",No window,,Stayed in September 2019,6.1,6.2,5.7,7.3,5.7,6.1,5.7,6.5
