Sandpiper Hotel,Reviewed: 29 March 2019,Sweden,4.2,3,“Not okay.”,"['• Solo traveller', '• Superior Double or Twin Room (No Window)', '• Stayed 3 nights']",I had to pay a lot more money than the real price. Cause I booked the wrong month. As I noticed this 1 min after booking and reashed out for help I thought they would be kind to help me. But not. Communication was bad. They had me paying dubble. Staff were not friendly as I arrived in the night time. The girl who worked as I left where kind and helpsome. But can not recommend this place. Service minded and helpful stuff is the key for making a stay feel good and I lacked that from this place.,,Stayed in March 2019,6.1,6.2,5.7,7.3,5.7,6.1,5.7,6.5
Sandpiper Hotel,Reviewed: 27 March 2019,Indonesia,7.1,7,“Location is good.”,"['• Business trip', '• Solo traveller', '• Superior Double or Twin Room (No Window)', '• Stayed 1 night', '• Submitted via mobile']","The staff were so arrogant and irresponsible. I have asked for an early check in. Even after there check in time of 2pm the room were not ready. They have given me a 2 bed instead of a single bed.
Staff are so careless and not responsive.",Location is good. Very near to Rochor MRT which they r not mentioning on d discription provided.,Stayed in March 2019,6.1,6.2,5.7,7.3,5.7,6.1,5.7,6.5
Sandpiper Hotel,Reviewed: 20 March 2019,Philippines,5.0,1,“It's not so good. Restroom is poorly maintained.”,"['• Leisure trip', '• Group', '• Superior Double or Twin Room (No Window)', '• Stayed 1 night']",The restroom is poorly maintained and thought about. The water from the shower flowed towards the room floor. It was alarming a bit.,The LOCATION is super!,Stayed in March 2019,6.1,6.2,5.7,7.3,5.7,6.1,5.7,6.5
Sandpiper Hotel,Reviewed: 17 March 2019,India,8.3,3,“Good.”,"['• Solo traveller', '• Superior Double or Twin Room (No Window)', '• Stayed 7 nights']",Small Rooms and without a window it felt a bit too small.,Overall good experience. The rooms were a bit smaller than originally anticipated. But it was well kept. Location was good. The staff were also very helpful... especially Mr. Gill!,Stayed in March 2019,6.1,6.2,5.7,7.3,5.7,6.1,5.7,6.5
Sandpiper Hotel,Reviewed: 13 March 2019,Malaysia,2.5,3,"“Nothing like to say about this hotel
”","['• Leisure trip', '• Family with young children', '• Superior Double or Twin Room (No Window)', '• Stayed 1 night', '• Submitted via mobile']","Worst service extra charged ,once booked  paid via credit card and reach hotel mention no room available which I booked and given room that I didn't requested ,asked to pay extra for the room reason they given is 5 year old my son  stay with me is chargable !!","Nothing like to say about this hotel
 this is second time this hotel have issues ...",Stayed in March 2019,6.1,6.2,5.7,7.3,5.7,6.1,5.7,6.5
Sandpiper Hotel,Reviewed: 9 March 2019,Australia,2.5,4,“Room not proper room very smaall if go bed must use...”,"['• Couple', '• Superior Double or Twin Room (No Window)', '• Stayed 1 night', '• Submitted via mobile']",,Room not proper room very smaall if go bed must use staircase not allowed making coffe tea wht kind of hotel? Totoly very worst hotel only I stay 4 near masjid I change 81 Dixon rd hotel this  hotel room prperly room size,Stayed in March 2019,6.1,6.2,5.7,7.3,5.7,6.1,5.7,6.5
Sandpiper Hotel,Reviewed: 7 March 2019,New Zealand,2.9,4,“Nothing was good”,"['• Leisure trip', '• Couple', '• Superior Double or Twin Room (No Window)', '• Stayed 3 nights', '• Submitted via mobile']",Everything from staff being rude and not helpful to very small room and poor facilities l wonder how they got good reviews previous that was the only reason l book n got struck since it wasn’t refundable.,Nothing was good,Stayed in March 2019,6.1,6.2,5.7,7.3,5.7,6.1,5.7,6.5
Sandpiper Hotel,Reviewed: 1 March 2019,Singapore,3.3,1,“Refer above comments”,"['• Couple', '• Superior Double or Twin Room (No Window)', '• Stayed 1 night', '• Submitted via mobile']",Nothing......,"Hotel location is very good place but the rooms and facilities are very bad a d not for our expectations. Eventhough staff response is very poor and no hospitality mind.
Staffs are expecting money mind. Rooms are very small and also stagging water in toilet.",Stayed in March 2019,6.1,6.2,5.7,7.3,5.7,6.1,5.7,6.5
Sandpiper Hotel,Reviewed: 27 February 2019,Malaysia,7.1,1,“Price is good and convenient spot to stay in the heart of spore if u dont mind the small space”,"['• Leisure trip', '• Group', '• Superior Double or Twin Room (No Window)', '• Stayed 1 night', '• Submitted via mobile']","I was a bit dissappointed by my bed, as it was tilted and a bit hard, not sure whether the foot of the bed was broken or what. The clothing rack was super tiny and no room for me to be able to properly hang clothes from the built in hanger that u can't even take out to hang. The shower was not really hot though that's not much of an issue in a hot country. The room was not thoroughly cleaned as when i dropped my ring by the side of the bed, i could feel a lot of dusts under the bed and in the crevice between the bed and the table when i picked up the ring. Air cond was good, though the comforter has seen better days.","The location is great, superb, convenient - really near MRT station and lots of halal food/restaurants nearby. The staff are friendly though very busy.",Stayed in February 2019,6.1,6.2,5.7,7.3,5.7,6.1,5.7,6.5
Sandpiper Hotel,Reviewed: 15 February 2019,Australia,2.5,6,“How can you rate Sandpiper as a three star. I trust ur rating & booked the hotel.”,"['• Leisure trip', '• Couple', '• Deluxe Double or Twin Room', '• Stayed 1 night', '• Submitted via mobile']","Reception staffs are rude, not helpful at all. Booked a deluxe room for 110 dollars not worth even for 80dollars. Will never visit or never recommend to any.",,Stayed in February 2019,6.1,6.2,5.7,7.3,5.7,6.1,5.7,6.5
Sandpiper Hotel,Reviewed: 10 February 2019,Bulgaria,4.4,23,“Staff need customer service training”,"['• Leisure trip', '• Couple', '• Superior Double or Twin Room (No Window)', '• Stayed 4 nights', '• Submitted via mobile']","One of the lady receptionist was the most rude person I have met. I wouldn’t advise to hand in card key as I witnessed 2 guests helping them selves to cards whilst the receptionist was sleeping. The same night I was trying to get a good internet signal  due to a family bereavement and was trying to book flights. I asked if I could plug in my iPad in reception, the lady wagged her finger and spoke so rudely to me and told me to go to my room.",Gill the receptionist was so helpful. The location for the mrt was good.,Stayed in January 2019,6.1,6.2,5.7,7.3,5.7,6.1,5.7,6.5
Sandpiper Hotel,Reviewed: 31 January 2019,Malaysia,2.9,3,“Very unfriendly and not manage well by the staff.”,"['• Leisure trip', '• Group', '• Superior Double or Twin Room (No Window)', '• Stayed 2 nights', '• Submitted via mobile']","Pay extra charge $100 for extra people but only get extra towel n toothbrush. No matress given eventhough extra charge is expensive. Staff indian lady  is no good, misunderstood n no manners. Arrived at hotel 1am,get room at 230am. Ive booked 2weeks before and already charged my cc, but she wanted me to pay again. Will not go to this hotel again.",,Stayed in January 2019,6.1,6.2,5.7,7.3,5.7,6.1,5.7,6.5
Sandpiper Hotel,Reviewed: 20 January 2019,Indonesia,6.3,11,"“Good location
”","['• Leisure trip', '• People with friends', '• Superior Double or Twin Room (No Window)', '• Stayed 2 nights', '• Submitted via mobile']","Small room
No breakfast
Every corner you see indian people","Good location
Near mrt rochor or jalan besar
Ac cool
Hot water standby 24hour
Near 7eleven
Near food corner",Stayed in January 2019,6.1,6.2,5.7,7.3,5.7,6.1,5.7,6.5
Sandpiper Hotel,Reviewed: 19 January 2019,Australia,8.3,1,“Good value for money.”,"['• Leisure trip', '• Solo traveller', '• Superior Double or Twin Room (No Window)', '• Stayed 2 nights', '• Submitted via mobile']",Shower is the shower/toilet in one and I don’t think that was apparent when booking.,Good value for money. Good location just next to subway and not far from city centre.,Stayed in January 2019,6.1,6.2,5.7,7.3,5.7,6.1,5.7,6.5
Sandpiper Hotel,Reviewed: 12 December 2018,United Kingdom,4.2,10,“An unpleasant stay”,"['• Leisure trip', '• Couple', '• Superior Double or Twin Room (No Window)', '• Stayed 3 nights', '• Submitted via mobile']","The room was very cramped.It was in need of cleaning and refurbishment. There were legs missing from the beds, one bed being propped up by a brick.
The photos did not match the reality. 
Tea and coffee was available in the room, but the creamer was rationed to two per room per day!
The manager was more interested in her mobile phone than listening to customers complaints and suggestions.
I would not stay here again and would not recommend it even for one night.","There were two redeeming features of the Sandpiper Hotel........the location and Mr Gill.
From the moment we stepped into the lobby Mr Gill was friendly, welcoming and helpful.
The metro is just around the corner and little India is on your doorstep.",Stayed in November 2018,6.1,6.2,5.7,7.3,5.7,6.1,5.7,6.5
Sandpiper Hotel,Reviewed: 10 December 2018,Germany,5.8,4,“The location was actually directly in Little India so we...”,"['• Leisure trip', '• People with friends', '• Superior Double or Twin Room (No Window)', '• Stayed 2 nights', '• Submitted via mobile']","The WiFi did not really work the first day and when we went down to ask the staff they was super unfriendly. They fixed the problem the same day btw. 
We arrived at night so we don’t not check the room right away. 
But the next day we say used and dirty tissues and a lot of other dirt and trash under the bed. And under the mini bat were a lot coffee strips. 
This was not super nice at all!","The location was actually directly in Little India so we were surrounded by tons of nice restaurants, which I really liked. 
It was super close to Rocher MRT station. Just 50 meters away.",Stayed in December 2018,6.1,6.2,5.7,7.3,5.7,6.1,5.7,6.5
Sandpiper Hotel,Reviewed: 10 December 2018,India,7.9,2,“its good really”,"['• Business trip', '• Group', '• 2 rooms', '• Stayed 3 nights']","Some shower pipes were not maintained properly
TV is not good and the no of channels are only 10 and that is also not interesting.
wall cleaning was not done.","Neat and calm atmosphere
easy access
easy to go all shopping malls by walk
friendly approach
affordable price
it is easy access all type of food court & beverages 24 hrs.
Good hospitality.
Thanks.",Stayed in December 2018,6.1,6.2,5.7,7.3,5.7,6.1,5.7,6.5
Sandpiper Hotel,Reviewed: 5 December 2018,Philippines,8.8,1,"“location great, nice place and staff... will come back again!!!”","['• Leisure trip', '• Couple', '• Superior Double or Twin Room (No Window)', '• Stayed 4 nights']",Toilet need a little improvement it doesn't have bidet. Toilet with Bidet is a great convenience for your guest :),"Upon arrival we were warmly welcomed by the staff i forgot the name of the guy in the front desk and our room were upgraded with window (really appreciated). The location is also very convenient, near Rochor mrt station (walking distance), neighbors are friendly as well. The atmosphere here it felt like home. We enjoyed our stay :)",Stayed in November 2018,6.1,6.2,5.7,7.3,5.7,6.1,5.7,6.5
Sandpiper Hotel,Reviewed: 3 December 2018,Australia,7.1,20,“Great location in Little India.”,"['• Leisure trip', '• People with friends', '• Superior Double or Twin Room (No Window)', '• Stayed 1 night', '• Submitted via mobile']","Rooms are very small, single beds almost touching each other.",Great location in Little India. Guy at the front desk was very friendly and made us feel welcome,Stayed in November 2018,6.1,6.2,5.7,7.3,5.7,6.1,5.7,6.5
Sandpiper Hotel,Reviewed: 29 November 2018,Malaysia,4.2,1,“advisable for short stay only”,"['• Business trip', '• Solo traveller', '• Superior Double or Twin Room (No Window)', '• Stayed 1 night']","I cannot get a well sleep as the bed had bed bugs. When I took up the blanket, it was transparent and I can see it was black in color inside the blanket.",Convenient to my meeting place.,Stayed in November 2018,6.1,6.2,5.7,7.3,5.7,6.1,5.7,6.5
Sandpiper Hotel,Reviewed: 25 November 2018,Malaysia,5.0,1,"“The receptionist very rude, not friendly at all.”","['• Leisure trip', '• Family with young children', '• Family Nest - No Window', '• Stayed 1 night', '• Submitted via mobile']","The receptionist very rude, not friendly at all. At the 1st place we plan to come 6 person so we book 2 room with 1 queen bed and 1 single. But it came to hppens that we need to bring our 4 years old child. The hotel charges us 30sgd for 1 kids bcause they claim that during booking we only mention 6 person. So we need to pay for extra person.30 sgd for 4 years kid but no extra bed or extra mattres given, so what the 30sgd been paid for? We dont want to argue because  the receiptionist started yell at us. Very rude.. and during check out, we need to wait for 15 mnts bcause nobody at the kaunter. The staff left the counter without notice. We need to wait even we were in hurry. That was the frst and the last i stayed in this hotel. Not recomendded at all",,Stayed in November 2018,6.1,6.2,5.7,7.3,5.7,6.1,5.7,6.5
Sandpiper Hotel,Reviewed: 15 November 2018,Thailand,7.5,2,“ok”,"['• Solo traveller', '• Deluxe Double or Twin Room', '• Stayed 4 nights']","The girls on Reception, couldn't raise a smile out of them, and didn't like the shower  situation over the toilet basically and the hot water switch outside the room.","Mr Gil on reception, the one person who made me feel at home, was forever helpful and friendly, he quite made may stay.",Stayed in November 2018,6.1,6.2,5.7,7.3,5.7,6.1,5.7,6.5
Sandpiper Hotel,Reviewed: 22 October 2018,United Kingdom,2.9,2,“Rubbish”,"['• Leisure trip', '• Solo traveller', '• Superior Double or Twin Room (No Window)', '• Stayed 6 nights', '• Submitted via mobile']","Noisy staff during the night while sleeping. Taking in the corridor at 1am in the morning. Insects in the room, dirty and needs updating. Shower did not have running hot water.",Nothing!,Stayed in October 2018,6.1,6.2,5.7,7.3,5.7,6.1,5.7,6.5
Sandpiper Hotel,Reviewed: 5 October 2018,Spain,10,11,“Staff were excellent especially Gill who was very helpful...”,"['• Leisure trip', '• Couple', '• Deluxe Double or Twin Room', '• Stayed 2 nights', '• Submitted via mobile']",We stayed here twice first room was a little small but second room was great,Staff were excellent especially Gill who was very helpful and very courteous,Stayed in September 2018,6.1,6.2,5.7,7.3,5.7,6.1,5.7,6.5
Sandpiper Hotel,Reviewed: 24 September 2018,Japan,9.2,2,“Location is great;”,"['• Leisure trip', '• Solo traveller', '• Superior Double or Twin Room (No Window)', '• Stayed 4 nights']","For some reason, even if I change the the settings of the air conditioner, the temperature does not change.
Aside from that, no other issues. This hotel is on the cheap side so I did not really expect much.","Location is great; it is very near 2 stations and a lot of restaurants/malls. Usual tourist spots are near enough by subway.
The staff are great; Mr. Gil helped me a lot from my check in until my last day. Very courteous staff.
Amenities are as to be expected as from the money paid; you do get what you pay for with this hotel",Stayed in August 2018,6.1,6.2,5.7,7.3,5.7,6.1,5.7,6.5
Sandpiper Hotel,Reviewed: 14 September 2018,India,6.7,3,“too much noise from guests.”,"['• Business trip', '• Solo traveller', '• Superior Double or Twin Room (No Window)', '• Stayed 4 nights']",Noise from neighbours,"too much noise from guests. however hotel management was kind enough to shift my room.
Mr. Gill the manager was extremely courteous and friendly.",Stayed in September 2018,6.1,6.2,5.7,7.3,5.7,6.1,5.7,6.5
Sandpiper Hotel,Reviewed: 6 September 2018,Spain,9.2,11,“All the staff were professional and helpful.”,"['• Leisure trip', '• Couple', '• Deluxe Double or Twin Room', '• Stayed 3 nights', '• Submitted via mobile']",Small fridge would have made the stay much better apart from that for value for money it can't be faulted,All the staff were professional and helpful. First class location,Stayed in September 2018,6.1,6.2,5.7,7.3,5.7,6.1,5.7,6.5
Sandpiper Hotel,Reviewed: 28 August 2018,United Kingdom,9.2,5,"“- Very good location near the MRT
”","['• Leisure trip', '• Couple', '• Superior Double or Twin Room (No Window)', '• Stayed 5 nights', '• Submitted via mobile']","- only slight issue is the size of the room, but this is expected given the cost of the room in Singapore","- Very good location near the MRT
- Staff were very friendly, especially Gil
- Room was clean and good amenities were provided (free water everyday)",Stayed in August 2018,6.1,6.2,5.7,7.3,5.7,6.1,5.7,6.5
Sandpiper Hotel,Reviewed: 22 August 2018,Australia,7.9,5,“The staff was very kind and helpful.”,"['• Leisure trip', '• Couple', '• Superior Double or Twin Room (No Window)', '• Stayed 2 nights', '• Submitted via mobile']",I went with my wife. We didn't like the neighborhood to much. But the hotel still being a good value for money.,The staff was very kind and helpful.,Stayed in August 2018,6.1,6.2,5.7,7.3,5.7,6.1,5.7,6.5
Sandpiper Hotel,Reviewed: 11 August 2018,United Arab Emirates,3.8,8,“Disappoited”,"['• Leisure trip', '• Family with young children', '• 2 rooms', '• Stayed 6 nights', '• Submitted via mobile']","Everything👹
Just want to charge for everything 50 $ 
Without any service 
The women on the desk asked for early checkin that was at 12.45 pm as they checkin at 14 hr
If u make the tea in kettle u will be charged again 50 
Just have to boil the water
Not used any service of them just used unhygenic beds for sleeping purpose
And also paid $ 50 for early checkin
Room size is a crap and digusting
Just 1 word for them DISAPPOINTED",Nothing,Stayed in August 2018,6.1,6.2,5.7,7.3,5.7,6.1,5.7,6.5
Sandpiper Hotel,Reviewed: 9 August 2018,Singapore,7.9,1,"“Very good location, 2 mins walk to mrt”","['• Leisure trip', '• Family with young children', '• Family Nest - No Window', '• Stayed 8 nights', '• Submitted via mobile']","They have basement room, luckily they change me to a better room after I made request for not staying at the basement","Very good location, 2 mins walk to mrt",Stayed in August 2018,6.1,6.2,5.7,7.3,5.7,6.1,5.7,6.5
Sandpiper Hotel,Reviewed: 1 August 2018,Saudi Arabia,3.3,15,"“Just one word-“HORRIBLE” Not recommended for “humans”...
”","['• Leisure trip', '• Family with young children', '• 2 rooms', '• Stayed 3 nights', '• Submitted via mobile']","Everything. Very Cold reception (Rude receptionist and manager). Tiny
rooms...(family stay- impossible) Zero facilities...very poor
management. We stayed as a family of 3elderly,1 feeding mother with
infant, 1 child and an adult... Very very unpleasant experience for us.
I strongly not recommend this hotel to any human being. Chinese
receptionist n manager...- Horrible and she received 250sgd for our
extension of stay after 12am -7pm last day(since our flight is around
9pm) ...didn’t give any receipt or any communication. We felt like
cheated. Anyways given a complaint letter at the desk that day, hope the
management receives it.","One and only factor is proximity to nearby Indian restaurants and
shopping areas.",Stayed in July 2018,6.1,6.2,5.7,7.3,5.7,6.1,5.7,6.5
Sandpiper Hotel,Reviewed: 30 July 2018,Philippines,4.2,1,"“aircon was slow, room was very small, no slipper.”","['• Business trip', '• Group', '• Deluxe Double or Twin Room', '• Stayed 1 night']","we booked a room thru booking.com, when we arrived said no room available, after 30 minutes of waiting to leave and finding  taxi, the OIC approach us, there`s a room available.",its clean,Stayed in July 2018,6.1,6.2,5.7,7.3,5.7,6.1,5.7,6.5
Sandpiper Hotel,Reviewed: 30 July 2018,Vietnam,3.5,1,“Bad experience”,"['• Leisure trip', '• Couple', '• Superior Double or Twin Room (No Window)', '• Stayed 2 nights', '• Submitted via mobile']",,"i booked that hotel sand piper however last minutes they said: thier room had some problem with air conditioner and they moved us to other hotel with support anything, they gave us adress new hotel : the new hotel is : chiang ziang hotel, it was 2 stars hotel but very bad hotel: wifi is very slow, i asked for clean room for second nights they said yes but nothing happpen. i heard from receptionist that: sand piper continued send other guests to their hotel as well, look like: sand piper hotel try to get more guests event they were fully booked and share benefit for other hotel.",Stayed in July 2018,6.1,6.2,5.7,7.3,5.7,6.1,5.7,6.5
Sandpiper Hotel,Reviewed: 21 July 2018,Denmark,5.8,17,“smal roome in indian part of city. not mouch sercive”,"['• Leisure trip', '• Couple', '• Superior Double or Twin Room (No Window)', '• Stayed 2 nights']","real small, hard to have roome for logage.
Rarley staf in reception, bout no bel or nothign to get in contakt to staf. tryed to phone them to check in, bout no anser to phone, so had to waith 30 minutes to check in, no knowing if the wood cone or now.",lice location,Stayed in July 2018,6.1,6.2,5.7,7.3,5.7,6.1,5.7,6.5
Sandpiper Hotel,Reviewed: 17 July 2018,Philippines,5.0,4,“It was just fine”,"['• Leisure trip', '• Family with young children', '• Family Nest - No Window', '• Stayed 5 nights', '• Submitted via mobile']",The male staff at the front desk when we arrived looked so serious and didnt smile at all. He may be efficient on our quiries but not effective. Our room was in the basement and no window.,The lady at the front desk when we checked out was very helpful. She called for taxi to drive us to the airport.,Stayed in July 2018,6.1,6.2,5.7,7.3,5.7,6.1,5.7,6.5
Sandpiper Hotel,Reviewed: 8 July 2018,Saudi Arabia,8.8,5,“made our vacation more memorable”,"['• Leisure trip', '• Group', '• Superior Double or Twin Room (No Window)', '• Stayed 2 nights']",,the location is very excellent for travellers.. going from one place to another is very convenient as it is located near MRT stations and close to the highway. food stalls are also a walking distance. great experience. staff were also very accommodating and kind,Stayed in July 2018,6.1,6.2,5.7,7.3,5.7,6.1,5.7,6.5
Sandpiper Hotel,Reviewed: 2 July 2018,Brunei Darussalam,3.3,3,"“There was nothing to like, only the cleaning staff was doing...”","['• Leisure trip', '• Family with young children', '• Superior Double or Twin Room (No Window)', '• Stayed 2 nights']","Well is a small hotel, the room they gave us was very very very small with no window, TV remote as not working so you can not use, when I went to exchange it they were not having spare and said they can not provide with no sorry on face, Never want to go again even this is the last option in the world.","There was nothing to like, only the cleaning staff was doing there job good.",Stayed in June 2018,6.1,6.2,5.7,7.3,5.7,6.1,5.7,6.5
Sandpiper Hotel,Reviewed: 17 June 2018,Malaysia,3.3,1,“only the location is good.”,"['• Leisure trip', '• Couple', '• Superior Double or Twin Room (No Window)', '• Stayed 2 nights']","Soundproof is very bad. can hear the noise from corridor
very noisy . can hear people still talking loudly outside during midnight. along the street 
near mosque so time to time got prayers which can be hear clearly . 
""Morning call"" from the mosque prayers. cant rest well at all.
No body washer.  only soap. which is very ridiculous . 1st encounter in my life.  
No water pipe to use for cleaning ( beside toilet bowl)
tiny pieces can be seen here and there . from the room facilities
Room is very small, don expect much for the paid price
Request for double bed but get 2 single bed instead",only the location is good. near to mrt station,Stayed in June 2018,6.1,6.2,5.7,7.3,5.7,6.1,5.7,6.5
Sandpiper Hotel,Reviewed: 17 June 2018,Thailand,8.3,12,“It was nice and worth the price.”,"['• Leisure trip', '• Group', '• Superior Double or Twin Room (No Window)', '• Stayed 3 nights']","The wall looks dirty but it's no big deal. I stayed here for three nights and let the staff clean my room everyday. However, they didn't change the bed sheets or covers.",The staff were very friendly. We get free bottles of water everyday which is something quite expensive in Singapore. The location is perfect and near MRT Rochor station. I'd love to stay here again.,Stayed in June 2018,6.1,6.2,5.7,7.3,5.7,6.1,5.7,6.5
Sandpiper Hotel,Reviewed: 14 June 2018,Australia,5.8,4,"“Good location , AC, and WIFI . better if staying for sleep only”","['• Business trip', '• Solo traveller', '• Superior Double or Twin Room (No Window)', '• Stayed 1 night']","They did not provide Tea bags, stupid excuse with an argument on arrival","No good size room as informed on booking.com, Great location and good Indian restaurants around 
Room accomodate no luggage",Stayed in June 2018,6.1,6.2,5.7,7.3,5.7,6.1,5.7,6.5
